{
  "$schema" : "http://json-schema.org/draft-07/schema#",
  "type" : "object",
  "properties" : {
    "@context" : {
      "type" : "array",
      "items" : {
        "type" : "string"
      }
    },
    "credentialSchema" : {
      "type" : "object",
      "properties" : {
        "id" : {
          "type" : "string"
        },
        "type" : {
          "type" : "string"
        }
      },
      "additionalProperties" : false
    },
    "credentialStatus" : {
      "type" : "object",
      "properties" : {
        "id" : {
          "type" : "string"
        },
        "type" : {
          "type" : "string"
        }
      },
      "additionalProperties" : false
    },
    "credentialSubject" : {
      "type" : "object",
      "properties" : {
        "holder" : {
          "type" : "object",
          "properties" : {
            "constraints" : {
              "type" : "object",
              "properties" : {
                "boundaries" : {
                  "type" : "string"
                },
                "circumstances" : {
                  "type" : "string"
                },
                "endTime" : {
                  "type" : "string"
                },
                "pointOfOrigin" : {
                  "type" : "string"
                },
                "radiusKm" : {
                  "type" : "string"
                },
                "startTime" : {
                  "type" : "string"
                }
              },
              "additionalProperties" : false
            },
            "id" : {
              "type" : "string"
            },
            "role" : {
              "type" : "string"
            }
          },
          "additionalProperties" : false
        },
        "id" : {
          "type" : "string"
        },
        "proxied" : {
          "type" : "object",
          "properties" : {
            "id" : {
              "type" : "string"
            },
            "permissions" : {
              "type" : "object",
              "properties" : {
                "grant" : {
                  "type" : "array",
                  "items" : {
                    "type" : "string"
                  }
                },
                "when" : {
                  "type" : "object",
                  "properties" : {
                    "role" : {
                      "type" : "string"
                    }
                  },
                  "additionalProperties" : false
                }
              },
              "additionalProperties" : false
            }
          },
          "additionalProperties" : false
        }
      },
      "additionalProperties" : false
    },
    "evidence" : {
      "type" : "object",
      "properties" : {
        "documentPresence" : {
          "type" : "array",
          "items" : {
            "type" : "string"
          }
        },
        "evidenceDocument" : {
          "type" : "array",
          "items" : {
            "type" : "string"
          }
        },
        "id" : {
          "type" : "string"
        },
        "subjectPresence" : {
          "type" : "string"
        },
        "type" : {
          "type" : "array",
          "items" : {
            "type" : "string"
          }
        },
        "verifier" : {
          "type" : "string"
        }
      },
      "additionalProperties" : false
    },
    "expirationDate" : {
      "type" : "string"
    },
    "id" : {
      "type" : "string"
    },
    "issuanceDate" : {
      "type" : "string"
    },
    "issuer" : {
      "type" : "string"
    },
    "proof" : {
      "type" : "object",
      "properties" : {
        "created" : {
          "type" : "string"
        },
        "creator" : {
          "type" : "string"
        },
        "domain" : {
          "type" : "string"
        },
        "jws" : {
          "type" : "string"
        },
        "nonce" : {
          "type" : "string"
        },
        "proofPurpose" : {
          "type" : "string"
        },
        "type" : {
          "type" : "string"
        },
        "verificationMethod" : {
          "type" : "string"
        }
      },
      "additionalProperties" : false
    },
    "type" : {
      "type" : "array",
      "items" : {
        "type" : "string"
      }
    },
    "validFrom" : {
      "type" : "string"
    }
  },
  "required" : [ "@context", "type" ],
  "additionalProperties" : false
}